### DISCUSSION TITLE
OnCancel callback are not getting called.

### DISCUSSION THREAD

**Discussion by pavanputhra** [emiago/sipgo#107] [Q&A] [answered]
I have created simple snipped as follows. I am using a SIP soft phone to initiate call. I see `INVITE received` log. But when I hang up I don't see `CANCEL received`

I am not sure what I am doing wrong here. Please help.

```go

func main() {
	addr := flag.String("l", "127.0.0.1:5060", "My listen ip")
	flag.Parse()

	setUpLogger()

	log.Info().Msg("Starting SIP server")

	// Setup UAC
	ua, _ := sipgo.NewUA(
	)

	log.Info().Msg("User agent setup")
	server, _ := sipgo.NewServer(ua)

	server.OnCancel(func(req *sip.Request, tx sip.ServerTransaction) {
		log.Info().Msg("CANCEL received")
	})

	server.OnInvite(func(req *sip.Request, tx sip.ServerTransaction) {
		log.Info().Msg("INVITE received")
		tx.Respond(sip.NewResponseFromRequest(req, sip.StatusTrying, "Trying", nil))
	})

	ctx, cancelFunc := context.WithCancel(context.Background())
	go server.ListenAndServe(ctx, "udp", *addr)
	log.Info().Msg("Server started at " + *addr)

	sig := make(chan os.Signal)
	signal.Notify(sig, os.Interrupt)

	select {
	case <-sig:
		cancelFunc()
		return
	}
}
```

Here is tcp dump if needed.

```logs
14:10:52.670719 IP localhost.51364 > localhost.sip: SIP: INVITE sip:d@127.0.0.1 SIP/2.0
E..q....@................].qINVITE sip:d@127.0.0.1 SIP/2.0
Via: SIP/2.0/UDP 127.0.0.1:51364;branch=z9hG4bK-524287-1---1a418237dadeb439;rport
Max-Forwards: 70
Contact: <sip:abc@127.0.0.1:51364>
To: <sip:d@127.0.0.1>
From: <sip:abc@localhost>;tag=e27775d6
Call-ID: 124591ZmRhZWU4NDU5N2RhM2RhNWY0NzM3YjI5M2ViZWZlMDk
CSeq: 1 INVITE
Allow: OPTIONS, SUBSCRIBE, NOTIFY, INVITE, ACK, CANCEL, BYE, REFER, INFO
Content-Type: application/sdp
Supported: replaces
User-Agent: Softphone
Content-Length: 346

v=0
o=- 1721378452665313 1 IN IP4 127.0.0.1
s=Softphone
c=IN IP4 127.0.0.1
t=0 0
m=audio 61728 RTP/AVP 120 9 18 0 8 101
a=rtpmap:120 opus/48000/2
a=fmtp:120 useinbandfec=1; usedtx=1; maxaveragebitrate=64000
a=rtpmap:18 G729/8000
a=fmtp:18 annexb=yes
a=rtpmap:101 telephone-event/8000
a=fmtp:101 0-15
a=sendrecv

14:10:52.674365 IP localhost.sip > localhost.51364: SIP: SIP/2.0 100 Trying
E..(o...@..................'SIP/2.0 100 Trying
Via: SIP/2.0/UDP 127.0.0.1:51364;rport;branch=z9hG4bK-524287-1---1a418237dadeb439
From: <sip:abc@localhost>;tag=e27775d6
To: <sip:d@127.0.0.1>
Call-ID: 124591ZmRhZWU4NDU5N2RhM2RhNWY0NzM3YjI5M2ViZWZlMDk
CSeq: 1 INVITE
Content-Length: 0


14:10:57.048421 IP localhost.51364 > localhost.sip: SIP: CANCEL sip:d@127.0.0.1 SIP/2.0
E..s\...@................_.rCANCEL sip:d@127.0.0.1 SIP/2.0
Via: SIP/2.0/UDP 127.0.0.1:51364;branch=z9hG4bK-524287-1---1a418237dadeb439;rport
Max-Forwards: 70
To: <sip:d@127.0.0.1>
From: <sip:abc@localhost>;tag=e27775d6
Call-ID: 124591ZmRhZWU4NDU5N2RhM2RhNWY0NzM3YjI5M2ViZWZlMDk
CSeq: 1 CANCEL
User-Agent: Softphone
Content-Length: 0
```

**Comment by emiago** [comment]
if cancel is termination of INVITE transcaction then this will be passed on transaction. Check go doc for ServerTransaction

**Reply by pavanputhra** [reply, marked as answer]
Yes, CANCEL belongs to the same INVITE.

After experimenting, I found the following:

By modifying the OnInvite handler as shown below and adding a select with the case <-tx.Cancels(), I receive the CANCEL message via the tx.Cancels() channel, but not through the OnCancel callback. I believe this is the intended behavior.


```golang
	server.OnInvite(func(req *sip.Request, tx sip.ServerTransaction) {
		log.Info().Msg("INVITE received")
		tx.Respond(sip.NewResponseFromRequest(req, sip.StatusTrying, "Trying", nil))
		select {
		case <-tx.Cancels():
			log.Info().Msg("CANCEL received in transaction")
			return
		}
	})
```
